{
  "$schema": "http://json-schema.org/draft-07/schema#",
  "$id": "TeachingMaterials/Metadata.schema.json",
  "title": "Teaching Material Metadata",
  "description": "Per EO-S1.1-002 v1.0's exact 11-field list (supersedes EO-S1.1-001 v1.1's initial reuse of Sprint AI-103's MetadataParser.js field names — that PascalCase set described a different context, the raw Metadata.json import file), plus EO-S1.1-003 v1.0's materialType addition. Every field must be present; unknown values are null (or [] for arrays) — never guessed or fabricated.",
  "type": "object",
  "required": [
    "materialId", "subject", "grade", "publisher", "chapter", "unit",
    "keywords", "difficulty", "source", "uploadDate", "version", "materialType"
  ],
  "properties": {
    "materialId": { "type": "string", "pattern": "^tm_[0-9]+$", "description": "Stable id, assigned once on first analysis, e.g. tm_1" },
    "subject": { "type": ["string", "null"] },
    "grade": { "type": ["string", "null"] },
    "publisher": { "type": ["string", "null"] },
    "chapter": { "type": ["string", "null"] },
    "unit": { "type": ["string", "null"] },
    "keywords": { "type": "array", "items": { "type": "string" } },
    "difficulty": { "type": ["string", "null"] },
    "source": { "type": ["string", "null"], "description": "e.g. 教科書/講義/考卷/教師補充教材 — the material's real, disclosed origin" },
    "uploadDate": { "type": ["string", "null"], "format": "date-time", "description": "When Project Owner provided this material, not when it was originally published" },
    "version": { "type": ["string", "null"], "description": "Incremented when Existing Material is updated per the Import Rule; starts at \"1\"" },
    "materialType": {
      "type": "string", "enum": ["TEXTBOOK", "HANDOUT", "EXAM", "HOMEWORK", "PPT", "REFERENCE"],
      "description": "EO-S1.1-003. materialType=EXAM triggers the Original Question Rule: every question in this material's questions.json must be questionSource=ORIGINAL, enforced cross-file by scripts/ValidateMaterial.js."
    }
  },
  "additionalProperties": false
}
