{
  "materialId": "tm_4",
  "subject": "地理",
  "grade": "高一",
  "publisher": null,
  "chapter": "全球化與國際分工、產業區位與人口移動（世界體系理論、新國際分工、工業4.0、宗教信仰與族群、板塊與氣候、地名學）",
  "unit": "114學年度第二學期第三次段考",
  "keywords": ["全球化", "世界體系理論", "新國際分工", "工業4.0", "核心邊陲", "人類發展指數", "板塊運動", "地名學", "移工"],
  "difficulty": null,
  "source": "考卷",
  "uploadDate": "2026-08-03T00:00:00Z",
  "version": "1",
  "materialType": "EXAM"
}
